{
  "contract_version": "1.0",
  "task_id": "diag_case0001",
  "task_type": "paper_positioning_diagnostic",
  "idempotency_key": "idem_task_case0001_submit",
  "input": {
    "document_id": "doc_case0001",
    "document_sha256": "aaaaaaaaaaaaaaaaaaaaaaaaaaaaaaaaaaaaaaaaaaaaaaaaaaaaaaaaaaaaaaaa",
    "language": "en",
    "candidate_venues": ["venue_example_a"],
    "decision_constraints": {"priority": "fit", "target_date": null, "notes": "Synthetic fixture."}
  },
  "authorization": {"estimate_id": "est_case0001", "maximum_billable_minor_units": 500, "currency": "USD"}
}

